도입_URL,가게이름,카테고리,전체평점,방문자리뷰,리뷰작성자,리뷰작성수,리뷰내용,방문시간,validated_label
"https://map.naver.com/p/entry/place/1878533608?c=13.00,0,0,0,dh",빙그레정육식당 인하대본점,"육류,고기요리",미공개,651,쩌싼,50,"인하대 문화의거리에 있는 정육식당
무릇 대학가에 있는 소고기 전문점은 가격이 걱정이든, 품질이 걱정이든 할텐데 그런 걱정이 전혀 없었습니다.
이전에 다른곳에서는 등심을 잘못먹어 고기를 고를 때 망설였는데, 그런 걱정을 한 시간이 아까울정도로 매우 부드러우면서도 육즙이 가득하고, 씹을수록 고소하다못해 달콤하기까지 한 맛이 아주 좋았습니다.
등심이 이정도인데 살치살과 꽃갈비살은 오죽했을까요? 뒤집어졌습니다.
지금도 다시 생각해보면 버터향이 느껴지지 않았나 착각이 들 정도였습니다.
다른 테이블에서는 비물냉면으로 추정되는 메뉴와 된장찌개도 시켰던데 다음에 저도 먹어봐야겠습니다.",24.3.5.화,0
"https://map.naver.com/p/entry/place/1426778024?c=15.00,0,0,0,dh",아재불닭발 인하대점,닭발,미공개,354,요잉66,37,"맛있어서 흡입
계란찜이 엄청 부드럽고 닭발 적당히 매워서 (맵찔이기준) 좋아요ㅎㅎ
주먹밥도 맛있습니당",9.3.수,0
"https://map.naver.com/p/entry/place/1973702909?c=13.00,0,0,0,dh",부리또정거장,"멕시코,남미음식",미공개,63,doo****,1,"늘 변함없는 맛, 아낌없이 쓰는 재료. 자취생 한끼 식사 하게 좋습니다. 잘먹었습니다 사장님ㅎㅎ",21.4.12.월,0
"https://map.naver.com/p/entry/place/1104224962?c=15.00,0,0,0,dh",압구정수산시장 인하대점,이자카야,미공개,94,너굴너굴79,36,"기본으로양도너무많고 가성비진짠너무좋아요
거기다가연어진짜너무맛있어요~~~은행꼬치도10개씩이나....그리고알바생분도 사장님도너무너무친절하세용~~~",3.20.목,0
"https://map.naver.com/p/entry/place/1393528546?c=15.00,0,0,0,dh",무한리필삼겹의난,돼지고기구이,미공개,312,eod****,34,처음 가본 식당인데 삼겹살이 정말 맛있고 간이 딱 맞더라구요 ㅎㅎ 다음번에도 와서 배 터지게 먹으려구요!!,21.2.28.일,0
"https://map.naver.com/p/entry/place/1711877761?c=13.00,0,0,0,dh",코피아,이탈리아음식,미공개,536,안주연82,35,"굿굿 여기서 맨날 시키는 게살 로제 파스타 앤드 오므라이스
난 이 오므라이스가 왜케 좋지;; 굿",6.6.금,0
"https://map.naver.com/p/entry/place/1574688174?c=15.00,0,0,0,dh",솥고기67번길,돼지고기구이,미공개,557,김미영6910,128,"가족들과 함께 고기먹으러 갔어요
집에서 걸어서 갈 수 있는 거리에 있어서 방문했는데
가성비가 상당히 좋은 고기집이네요
사장님도 친절하시고 매장도 넓어요
TV도 와이드스크린이있어서 야구경기 재밌게봤어요
나중에축구할때도 고기먹으러가면좋을거같아요
머리끈이랑 가글 등도 화장실에 있더라고요
무엇보다 고기가 신선하고 저렴하고
셀프바도 잘되어 있어서 이용하기좋았어요.",10.11.토,0
"https://map.naver.com/p/entry/place/1104224962?c=15.00,0,0,0,dh",압구정수산시장 인하대점,이자카야,미공개,94,heee9355,5,"한번가면 딴집 못가요~ 인하대 이자카야중 최고다!!
안주도 좋아!! 술 종류도 많아!! 이집 꽐라는 사랑입니다ㅋㅋㅋ
개인적 최애메뉴 스끼야키도 있어서 넘 조았어융!!!😍
쉬는날도 없어 언제든 방문하기 조타링~~~",24.3.10.일,0
"https://map.naver.com/p/entry/place/1711877761?c=13.00,0,0,0,dh",코피아,이탈리아음식,미공개,536,MissingDiana,166, 1위 메뉴 2개 시켯어요 ㅎ 로제 파스타 맵기 딱 좋구요 ㅎ 크림리조또꾸덕함도 합격입니다 ㅎ 가성비도 좋고 맛도 있어요 ㅎ  ,23.3.23.목,1
"https://map.naver.com/p/entry/place/1715722424?c=15.00,0,0,0,dh",인하 주먹고기,돼지고기구이,미공개,429,ygk****,16,"주먹고기 먹느라 사진을 못찍었는데 대체 로 고기들이
다 맛있구 사장님 및 직원분들이 친절해요",9.28.일,1
"https://map.naver.com/p/entry/place/1878533608?c=13.00,0,0,0,dh",빙그레정육식당 인하대본점,"육류,고기요리",미공개,651,범진팍,17,"너무너무 맛있습니다!! 자취하면서 정말 오랜만에 먹는데, 감동이네요…ㅠㅠㅠㅠ 이제 여길 알았다니!!",24.11.8.금,0
"https://map.naver.com/p/entry/place/1392141383?c=19.19,0,0,0,dh",효자동솥뚜껑 인하대점,돼지고기구이,미공개,608,냥고야이리온,814,"듀록 돼지고기가 정말 맛있는 인하대 후문 맛집이에요!
듀록이라니 역시 이름값 하는 고기네요!
육질이 부드럽고 야들야들해서 먹기 너무 좋고 식감이니 맛이니 정말 좋아요!
그리고 가성비가 정말 좋아서 이 질좋은 고기를 저렴하게 먹을 수 있어서 좋았어요!
인하대 후문에서 맛있고 가성비 좋은 돼지고기와 한 잔 하고 싶은 분들에게 강추드립니다!",5.10.토,0
"https://map.naver.com/p/entry/place/1878533608?c=13.00,0,0,0,dh",빙그레정육식당 인하대본점,"육류,고기요리",미공개,651,애교다니,1,"저희는 두툼한 등심과 살치살 먹어봤는데요!!
등심은 보통 씹는 맛이 좋다고들 하잖아요!!
두툼하지만 입에서 녹더라구용🥹
살치살은 얇게 준비해주셔서 그냥 바로 칙칙 구워서 바로 먹을 수 있었어용😘
고깃집 필수 절림양파에 밑반찬까지 다양했어용
고소한 미역국, 백김치, 깻잎장아찌, 무생채, 무말랭이까지!!
여러분!! 된장찌개 필수!! 🍲
미쳤다리!! 고기랑 건더기 보이세요??
엄청 실하고 맛있어서 밥 한공기 그냥 말아버렸어요😆 된장밥 완성해서 뚝딱했어용
물빔냉면은 양념이 들어간 물냉이라 소고기랑 찰떡이더라구용!!
쫄깃쫄깃 역시 고기엔 냉면👍
정육식당이라 직접 포장된 고기를 골라서
합리적인 가격에 즐길 수 있는 인후 소고기 맛집❤️
",23.8.30.수,0
"https://map.naver.com/p/entry/place/1393528546?c=15.00,0,0,0,dh",무한리필삼겹의난,돼지고기구이,미공개,312,bmy****,9,"무한리필 고기 맛없다는 편견은 버려야 할듯.. 존 ㅁ ㅌ
가성비 짱 !!!
사장님 친절 짱!!!
무엇보다도 고기 타지 않게 불조절도 잘 해주시고 왔다갔다 잘 봐주심.
느끼는 사람마다 다르겠지만 .. 전 만족합니당.
당연히 다음에도 또 방문할것임...
가격, 맛, 양, 위생, 서비스, 모든걸 바라는건 욕심...
참고하시고 배불리 맛있게 먹을수 있어서 완전 좋아요
",22.6.22.수,0
"https://map.naver.com/p/entry/place/20550561?c=15.00,0,0,0,dh",닭살부부,"치킨,닭강정",미공개,327,추어,143,"자주 포장해 가는데 리뷰는 처음 쓰는 것 같네요
목삼겹이 아주 맛있습니다
저희는 그래서 목살부부라고 부를 정도로ㅋㅋㅋㅋ
고기 먹고 싶을 때 주기적으로 포장해갑니다
진짜 너무 맛있어요 흑흑",23.3.14.화,0
"https://map.naver.com/p/entry/place/1393528546?c=15.00,0,0,0,dh",무한리필삼겹의난,돼지고기구이,미공개,312,wan1375,33,"삼겹살 + 냉면 = 완전 꿀조합 ❤️
진짜 맛있게 먹었어요 사장님도 친절하시고 맛이 최고라서 마음에 드네요",21.2.28.일,0
"https://map.naver.com/p/entry/place/1104224962?c=15.00,0,0,0,dh",압구정수산시장 인하대점,이자카야,미공개,94,브라운3094,134,"인하대 방어 맛집 압구정 수산시장! 일본 이자카야에 온듯한 분위기에 1차로 취하구 🙂‍↕️ 대방어 퀄리티에 2차로 취한.🐷🐟🌊 웰컴 드링크로 사케도 한잔 주셨는데, 맛이 좋아서 무제한 사케로 즐기셔도 좋을듯! 방어 기름기가 미쳤어요",24.12.19.목,0
"https://map.naver.com/p/entry/place/31403012?c=15.00,0,0,0,dh",담벼락,요리주점,미공개,81,별님9506,1,인하대후문 또 먹고싶은 맛집✨김치찌개랑 연탄불고기 너무 맛있어요😄 밥 무조건 먹어야되고 맥주와 같이 먹으면 순식간에 든든한 한끼 먹을 수 있습니다🩵그리고 간단한 안주도 많아서 언제든 와서 먹고 가기 좋더라구여👀,1.24.금,0
"https://map.naver.com/p/entry/place/32812014?c=15.00,0,0,0,dh",봉구스밥버거 인하대점,분식,4.4,137,바니공주님,87,"봉구스 사장님, 직원분들 다 너무 친절하셔서 재방문하게 되는 것 같아요 XD
맛있어요!!🩵",23.6.14.수,0
"https://map.naver.com/p/entry/place/1368578135?c=15.00,0,0,0,dh",박지혜 모던순대국 소머리국밥 인하직영점,"순대,순댓국",미공개,499,솔러블리,152,"순대국이랑 뼈해장국. 만두를 주문했는데
세 가지 메뉴 다 맛있게 잘 먹었어요.
순대국에 다대기도 넣고 밥말아먹으면 꿀맛이네요~
인하대 국밥 맛집으로 인정입니다^^",24.2.26.월,0
"https://map.naver.com/p/entry/place/1748522357?c=13.00,0,0,0,dh",큐슈울트라아멘 인하대점,일본식라면,미공개,279,쏘나38,20,"맛있어요,,,♡♡♡ㅎㅎㅎㅎ규동집 맛있는 곳 없었는데 이곳으로 정착합니다
교자도 육즙 미쳤어요🥰
추천추천",24.8.12.월,0
"https://map.naver.com/p/entry/place/1807428763?c=15.00,0,0,0,dh",맥주집,"맥주,호프",미공개,167,h2wngml,7,오랜만에 애들이랑 왔는데 간단하게 안주시켜서 떠들기도 너무 좋고 직원분들도 너무 친절해서 기분좋았어요 !! 자주올게요💕💕,10.27.월,0
"https://map.naver.com/p/entry/place/1939722709?c=13.00,0,0,0,dh",덮수룩,한식,미공개,149,esa****,19,오랜만에 덮밥 먹고싶어서 들어왔는데 너무 맛있네요 양도 많고 맛있습니다!!! 저는 항정살 덮밥 먹었는데 다음에는 스테이크덮밥 먹어보려구요ㅎㅎ,2.2.일,0
"https://map.naver.com/p/entry/place/2098595079?c=13.00,0,0,0,dh",행컵 인하대점,"도시락,컵밥",미공개,273,didusd46,12,"인하대에 컵밥집이 없었는데, 생겨서 너무 좋아요. 컵밥도 맛있어서 앞으로 여기만 올 거 같아요!",5.21.수,0
"https://map.naver.com/p/entry/place/1772330524?c=13.00,0,0,0,dh",롤링파스타 인하대점,"스파게티,파스타전문",미공개,252,seoung,376,"롤링파스타 인하대점에서 식사했는데, 음식이 맛있고 가성비가 좋았어요. 직원들도 친절하고 매장 분위기도 깔끔해서 편하게 식사할 수 있었습니다! 😊",3.6.목,1
"https://map.naver.com/p/entry/place/1963692965?c=15.00,0,0,0,dh",정인곱창 인하본점,"곱창,막창,양",4.77,418,봉날두,54,"여러분 무조건 추천합니다. 다 구워주셔서 편하게 먹을수 있고, 김치말이국수랑 볶음밥도 찐맛집입니다.",10.25.토,0
"https://map.naver.com/p/entry/place/1678525038?c=13.00,0,0,0,dh",삼청당 인하대점,분식,미공개,620,suj****,10,인하대 후문에서 찾은 김밥 맛집!!! 떡볶이랑 같이 먹으면 얼마나 맛있게요~? 후회안합니다 꼭 드시러 오세요!!,23.10.5.목,0
"https://map.naver.com/p/entry/place/1479468560?c=15.00,0,0,0,dh",한창희천하일면 인하대점,국수,미공개,395,연석준,7,사장님 너무 친절하시고 라멘 너무 맛있습니다 감사합니다 너무 추천합니다 항상 번창하세요!!,10.28.화,0
"https://map.naver.com/p/entry/place/36271040?c=15.00,0,0,0,dh",이모떡즉석떡볶이,떡볶이,4.64,464,인천학스,573,"용현동 인하대후문에 즉석떡볶이집이 있는지는
몰랐네요~~!! ㅎㅎㅎ
학생들이 많은 지역이라 가격도 저렴하고,,,
맛도 좋네요~!
아이랑 같이 먹을수 있어서 좋아요!!
단무지까지 맛있네요,,!! ㅎㅎ
잘먹고 가요!!^^",5.17.토,0
"https://map.naver.com/p/entry/place/1102006774?c=13.00,0,0,0,dh",샐러리아 인하대점,"다이어트,샐러드",미공개,634,레모나32,13,게살와사비마요 샌드위치 주문했는데 흔하지 않은 맛이고 맛있어서 다음에도 또 방문 할 것 같습니다!,24.9.11.수,0
"https://map.naver.com/p/entry/place/1878533608?c=13.00,0,0,0,dh",빙그레정육식당 인하대본점,"육류,고기요리",미공개,651,das****,53,소고기 너무 맛있는 빙그레정육식당.. 가격도 착한데 이렇게 맛있어도 되나요ㅠㅠ 소고기 먹고싶을때마다 여기로 오기로 정했어요 ㅋㅋ 둘이서 배터지게 먹고 갑니다 자주올게요❤️,23.12.22.금,0
"https://map.naver.com/p/entry/place/1866654241?c=15.00,0,0,0,dh",멘야토리 라멘,일본식라면,미공개,150,hei****,7,"거짓말 안 치고 3끼로 매일 먹기 가능 솔직히 나만 알고 싶음 바빠지면 이 퀄리티 안 나올까봐
근데 근처에 프랜차이즈 라맨집 갈거면 그냥 ...젭알....
나 한번 믿고 여기로 오시길... 진심 맛없었으면 나한테 채팅 남기면 내돈내산 환불해드림
본인 10년차 미식가 호소인임
블로그 협찬 받아서 다니는 것도
귀찮아서 오마카세급만 가끔함
네이버 영수증 리뷰...? 귀찮아서 안 적음
10분이상 걷기 귀찮아서 택시탐
귀찮으면 죽어버리는 개복치임🐡
근데 멘야토리는 무려 15분 걸어서
최소 20번은 내돈내산으로 왔음
루틴이 되어버림 주에 입맛 없거나 배고프면 1~3번 정도 꾸준히 감",6.17.화,0
"https://map.naver.com/p/entry/place/1574688174?c=15.00,0,0,0,dh",솥고기67번길,돼지고기구이,미공개,557,uwnstkd1414,17,"인하대 주변 삼겹살집 찾다가 발견했어요!!!
솥뚜껑에다가 구워서 감성도 챙기고 맛도 있네요 ㅎㅎ
가격도 저렴해서 자주 올거 같아요 하고 거대한 스크린도 있어가지고 단체 회식 자리로 좋아요!!! 반찬들도 셀프바에 잘 되어있어가지고 야무지게 먹었습니다 :)
재방문 해야지~",24.11.22.금,0
"https://map.naver.com/p/entry/place/1294587914?c=13.00,0,0,0,dh",레오펍 인하대점,피자,4.68,564,jh480,98,피자 사이즈도 큰데 가격도 저렴해서 가성비 좋은 곳이에요!! 사이드메뉴인 불고기베이크도 너무 맛있는 곳👍,6.22.일,0
"https://map.naver.com/p/entry/place/1001196125?c=13.00,0,0,0,dh",꽃피는 꽃삼겹,돼지고기구이,4.73,163,하W,81,"고기 정말 맛있습니다.
근데 볶음밥은 맛있는걸 넘어섰습니다. 고기의 맛은 알면서 이 볶음밥의 맛은 몰랐던게 너무 안타깝습니다. 지금이라도 알아서 다행이라는 생각이드는 맛입니다. 고추장비빔밥을 그냥 불판위에 퍼주는 것과는 전혀 다른 맛입니다. 불향이 살짝나는 것 같으면서 고기의 고소함도 느껴는 맛입니다. 강추드리겠습니다.",20.12.19.토,0
"https://map.naver.com/p/entry/place/1776211168?c=13.00,0,0,0,dh",삭금,요리주점,미공개,118,123****,252,조용하고 대화하기 좋은 분위기에 인테리어가 깔끔했어요 음식 가격이 합리적이었고 양도 넉넉해서 좋았어요! 감자전은 채로 썬 감자전이라 정성이 느껴졌어요 직원분이 친절하시고 음식도 맛있어서 좋은 시간 보냈습니다,24.11.25.월,0
"https://map.naver.com/p/entry/place/1392141383?c=19.19,0,0,0,dh",효자동솥뚜껑 인하대점,돼지고기구이,미공개,608,kyh90,13,"둘이 가서 세트 메뉴 하나 시키고 너무 맛있게 잘 먹었어요!
양도 엄청 넉넉하고 밑반찬도 단정하니 고기랑 잘 어울려서 남김 없이 먹었습니다🤤
재방문의사 100.. 새로 생겨서 깨끗하니 더 좋았어요",5.28.수,0
"https://map.naver.com/p/entry/place/1479468560?c=15.00,0,0,0,dh",한창희천하일면 인하대점,국수,미공개,395,룰루제로,297,얼큰고기국수 먹었습니다. 자칫.느끼할 수.있는 고기육수를 마늘이 잡아줍니다. 생각보다 담백해요! 여기 양이 진짜 대혜자입니다. 중 시켰는데요.. 먹어도 먹어도 줄지를 않아요.. 양이 어마어마합니다. 저 꽤 많이 먹는 사람인데 완면 못 했어요. 여자분들 되도록 소 시키세요.,7.17.목,0
"https://map.naver.com/p/entry/place/1710907962?c=13.00,0,0,0,dh",뭉클로 샌드위치 디저트,샌드위치,미공개,140,포항항항항포항항항,54,"헉 존맛 저만 알고픈데 공유 할게요
가성비 쩔고 사장님 친절하고 음식 맛있고
가볍게 먹을수 있어요.
다이어터에겐 최고 안다이어터에게도 최고
진짜 짱 맛나요.
흥해서 서울에도 열어주셨음 좋겠는 바램이 케케케",21.9.13.월,0
"https://map.naver.com/p/entry/place/2009691902?c=15.00,0,0,0,dh",디탕 인하대점,베트남음식,미공개,376,iny****,268,인하대맛집입니다. 생긴지 얼마 안된 것 같기는 한데 정말 베트남 쌀국수 중 최고 입니다. 꼭 와보세요 베트남 갈 필요가 없어요 진짜 맛집 입니다.,7.11.금,0
"https://map.naver.com/p/entry/place/1042128520?c=13.00,0,0,0,dh",오이아샌드위치 인하대,샌드위치,미공개,179,이주연1454,35,"일주일에 한두번씩 꼭 먹는 곳인데, 드디어 리뷰 남깁니다 ㅎㅎ!
가격도 괜찮으면서 맛도 있고 위에 부담가지 않는 식당이 인하대 주변에 많지 않아서 애용하고 있어요 (제 방문 수가 증명합니다!!)
토마토를 못 먹어서 요청사항에 적으면 그날 상황에 따라 라페나 치즈 등 다른 재료를 더 넣어주시는 사장님께 항상 감동받고 있어요 🤍
제가 학교를 떠나기 전까지 계속 있어주시길 간절히 바랍니다!! 🥹",24.10.22.화,0
"https://map.naver.com/p/entry/place/1075301874?c=15.00,0,0,0,dh",일미닭갈비파전 인하대점,닭갈비,미공개,190,전부다리뷰,1,치즈닭갈비에 우동사리 추가해서먹었는데 워낙 먹자골목이라그런가 평균가게들에 비해서 가격도 맛도 그냥저냥...,24.10.6.일,0
"https://map.naver.com/p/entry/place/1715794350?c=13.00,0,0,0,dh",카페밥엔술,양식,미공개,77,사도세자39,14,"진짜 모든분들이 너무 친절했어요
들어가자마자 진철하게 안내해주셨고
음식이 나오기 전부터 식기세팅을 직접 해주시고 너무 좋았어요
거기다 음식이 너무 맛있어서 물어봤는데
100%국내산 치즈, 100%덴마크 크림을 사용한다 하시더라고요
제일 좋은건 미친 가성비입니다 이렇게 다 해도 3만원이 안돼요
하우스 와인도 너무 훌룡했습니다!
보통 화이트 와인은 샤르도네가 대부분인데 여기는 쇼비뇽블랑을 주시더라거요 거기다 말보르!!!
진짜진짜 가성비좋은 맛집입니다
오늘은 밥 먹으러 왔는데 다음엔 여자친구랑 술마시러도 와볼려고요!
진짜 추천합니다!!!!",6.15.일,0
"https://map.naver.com/p/entry/place/1392141383?c=19.19,0,0,0,dh",효자동솥뚜껑 인하대점,돼지고기구이,미공개,608,eyl****,2,예약없이 바로 왔는데 바로 식사 시작했습니다!! 친절하신 사장님 덕분에 재미있게 먹고갑니다~~,7.29.화,1
"https://map.naver.com/p/entry/place/38548187?c=15.00,0,0,0,dh",영지숯불갈비 본점,돼지고기구이,미공개,435,옥쮜,1,와 진짜 가성비 최고!!! 가격도 너무 저렴하고 양도 옴총 마나요!! 어디가서 이 양에 이 가격에 이 맛을 먹을 수 있을까요!! 사장님도 짱짱 친절하세로오오,21.3.3.수,1
"https://map.naver.com/p/entry/place/1001196125?c=13.00,0,0,0,dh",꽃피는 꽃삼겹,돼지고기구이,4.73,163,화성인 식탐여교사의 먹스테이,1,"배부르고 맛있게 먹었어요
꽃삼겹 10000원, 술 5000원,
계란찜 4000원, 물냉면 5000원
저렴하고 맛있어요",24.12.22.일,0
"https://map.naver.com/p/entry/place/1160321792?c=13.00,0,0,0,dh",슬로우캘리 인하대점,"다이어트,샐러드",미공개,230,Memory123,21,야채랑 연어 전부 신선하고 비율도 잘 맞아서 소스 없이도 맛있었습니다. 사장님께서 굉장히 친절하셔서 기분이 좋았어요. 계란도 하나씩 무료로 가져갈 수 있어요. 건강하고 맛있게 잘 먹었습니다. 또 올 것 같아요.,5.21.수,0
"https://map.naver.com/p/entry/place/1368578135?c=15.00,0,0,0,dh",박지혜 모던순대국 소머리국밥 인하직영점,"순대,순댓국",미공개,499,박규리850,71,"믿고 먹는 맛집 박지혜 모던순대국 !👍👍
24시간 영업 하셔서 공부하다 출출할 때 먹기에도 좋고 얼큰한 맛이 해장 하기도 딱 좋습니다🔥 요즘 인하대후문 물가가 많이 올라서 술 가격이 다들 비싸졌는데도 요즘 같은 물가에 3500 원이라는 저렴한 가격에 소주를 먹을 수 있는 점도 정말 좋았어요! 😵 저는 얼큰 수육 국밥에 항상 당면을 추가해 먹는데 당면 양도 정말 많고 건더기 양도 정말 많아 든든한 한끼를 해결할 수 있습니다 🥹 이번에 처음으로 만두를 시켜 먹었는데 쪄서 나오는 만두가 정말 맛있더라구요 항상 출출할 때 국밥하면 생각나는 곳입니다 사장님도 정말 친절하시고 티비도 있어서 혼밥하기에도 정말 좋은거 같아요 앞으로도 계속 인하대에 남아계셔 주세요",24.2.3.토,0
"https://map.naver.com/p/entry/place/1770290012?c=15.00,0,0,0,dh",커리야,인도음식,4.62,907,bear6538,14,소문대로  맛있네요  먹다보니양도많구요^^카레는 간단한음식으로인식했었는데  여기와서먹어보니  요리네요^^다음엔시금치커리꼭먹어볼거예요^^먹으면서  다음에또올 일정잡았네요^^,5.28.수,0
"https://map.naver.com/p/entry/place/1406506965?c=15.00,0,0,0,dh",하노이별 인하대점,베트남음식,미공개,430,래퍼,4,"베트남에서 먹는 분위기와 맛을 느낄수 있는 식당이였습니다.
쌀국수 국물 끝내줍니다.
재방문 할거 같아요.",24.9.21.토,0
"https://map.naver.com/p/entry/place/1776211168?c=13.00,0,0,0,dh",삭금,요리주점,미공개,118,빛선비,12,"정말 자주 가서 먹어요!
혼밥하기도 좋고, 친구랑 가기도 좋아요
오늘의 정식 너무 좋아요!!",23.11.30.목,0
"https://map.naver.com/p/entry/place/87238504?c=15.00,0,0,0,dh",계속 쪼르면,종합분식,미공개,938,kcwhang88,197,"튀김은 바삭하니 너무 맛있었구요 떡볶이 돈까스 조합 좋아요.
다 너무 푸짐하게 맛있게 잘먹었습니다 ~!",21.1.28.목,0
"https://map.naver.com/p/entry/place/1801858940?c=13.00,0,0,0,dh",하하돈면,한식,미공개,262,아키007,13,후문에 새로운 돈가스 맛집을 찾아서 너무 좋습니다! 양이 많아서 항상 다 못먹어요ㅠㅠ 매장이나 셀프바도 청결하게 유지하셔서 갈 때마다 안심하고 먹을 수 있는 거 같아요. 돈가스 소스나 깍두기도 다 직접 만든다고 하시던데 그래서 그런지 정말 맛있습니다! 김치 나베는 많이 먹어봤는데 여기는 맑은 돈가스 나베도 있네요. 이게 진짜 맛있어요ㅎㅎ 2층이라 그런지 주위 친구들이 잘 모르던데 돈가스 좋아하시면 꼭 와보시길 추천합니다! 오래 장사해주세요 제발...😭,24.2.22.목,0
"https://map.naver.com/p/entry/place/1227121732?c=15.00,0,0,0,dh",돈마니,돈가스,미공개,179,가지남,127,"현금 7500원 / 카드 8000원 (이음카드 400원 적립)
메인 음식인 돈까스, 생선까스는 다른 돈까스 집 보다 맛은 조금 떨어집니다 하지만 무한리필집이잖아요? 이해해야죠~ 겉의 튀김이 너무 딱딱했고 돈까스 2장 생선까스 1장 먹었네요. 두꺼운건 너무 질겨서 꼭 얇은거 드세요. 반찬은 다양해서 조금씩 찍먹이 가능해요 개인적으로 반찬에서는 김치를 주로 먹었고 제육볶음, 매콤한 장국, 토스트 식빵+잼이 제일 맛있었네요. 그외 떡볶이, 카레, 스프, 소면도 낫배드
성비 남자 9 : 여자 1 압도적, 독서실을 방불케 하는 조용함 (돈까스 써는 소리만 들림), 셀프방식이라 음식물을 거의 남기지 않고 다 먹고 가면서 진상 또는 컴플레인 없으며 대부분 혼밥으로 와서 20~30분 컷하고 돌아가는 미친 회전률을 자랑함.",3.13.목,0
"https://map.naver.com/p/entry/place/1424888459?c=13.00,0,0,0,dh",양궈푸마라탕 인하대점,마라탕,미공개,330,오로라3043,8,"사장님이 너무 친절하셨고, 셀프바도 깔끔한데 무엇보다 소스를 포장할 수 있는 게 너무 좋아요! 오픈 이벤트로 고기도 무료라서 함 들려보세요!!",2.19.수,0
"https://map.naver.com/p/entry/place/1678525038?c=13.00,0,0,0,dh",삼청당 인하대점,분식,미공개,620,두둗,17,너무 맛있어요!! 자주 오고 있습니다 맛있게 먹겠습니다아 가볍게 먹고싶은 날 오시면 좋울 것 같아요,23.6.2.금,1
"https://map.naver.com/p/entry/place/2098595079?c=13.00,0,0,0,dh",행컵 인하대점,"도시락,컵밥",미공개,273,sso****,78,덮밥 비주얼이 좋네요 첫방문인데 맛있어요:) 재방문 의사 있습니다. 잘먹고 갑니다! 감사해요,6.11.수,0
"https://map.naver.com/p/entry/place/1801858940?c=13.00,0,0,0,dh",하하돈면,한식,미공개,262,san****,1,"튀김이 바삭바삭 아삭아삭 해요~~
샐러드가 소스비법이 굉장히 궁금합니다?
잘먹고 갑니다~~두 번째 메뉴라.😻😻",4.17.목,0
