도입_URL,가게이름,카테고리,전체평점,방문자리뷰,리뷰작성자,리뷰작성수,리뷰내용,방문시간,validated_label
"https://map.naver.com/p/entry/place/1767613585?c=15.00,0,0,0,dh",뼈앓이감자탕 용현점,감자탕,미공개,242,spi****,9,"새로운 매장이 생겼길래 와봤는데 양이 엄청 많네요
밥도 포함이라서 학생들이 배부르게 먹을 수 있을 것 같아요. 맛있습니다!",8.29.금,0
"https://map.naver.com/p/entry/place/87238504?c=15.00,0,0,0,dh",계속 쪼르면,종합분식,미공개,938,하늘수달,24,가격도 저렴하고 맛도 좋아서 한끼 식사로 정말 잘 먹었어요 매장도 청결하고 직원분들도 친절하세여,21.7.13.화,0
"https://map.naver.com/p/entry/place/1783349855?c=13.00,0,0,0,dh",멕시카나치킨 인하대점,"치킨,닭강정",미공개,84,라리가족,885,"인하대점에서는 처음 시켜봤는데
정말 맵고 아주 맛나네요 ㅋㅋ너무 매운데
계속 땡기는맛 너무 맛있습니다",22.8.5.금,0
"https://map.naver.com/p/entry/place/1470889138?c=13.00,0,0,0,dh",화양연화,요리주점,미공개,636,perfect2025,232,"안주 다양하고 너무 맛있고 분위기도 좋았어요 !!
가격도 저렴하고 조명도 화려해서 좋네요✨
매장도 넓고 최고👍🏻👍🏻",24.1.26.금,1
"https://map.naver.com/p/entry/place/36424011?c=13.00,0,0,0,dh",노랑통닭 인하대점,"치킨,닭강정",4.53,426,나노랑,25,"배달왔는데 후라이드 이거 너무 하지 않나요? 다 튀김옷만 있는 자투리가 반이에요,,,ㅋㅋㅋㅋㅋㅋㅋㅋㅋㅋㅋㅋㅋㅋㅋㅋㅋㅋ 뭘 먹으라는건지 참,,, 매장에서 먹었을때는 괜찮았는데 배달이라고 안보인다고 무시하는건가^^ 기분 참 안좋아요~!",22.7.15.금,0
"https://map.naver.com/p/entry/place/1767613585?c=15.00,0,0,0,dh",뼈앓이감자탕 용현점,감자탕,미공개,242,101****,29,"와~첨 와봤는데, 뼈해장국밥은 진짜 양 많고 맛있네요 제가 좋아하는 시래기도 잔뜩~^^얼큰하고 좋아요",10.8.수,0
"https://map.naver.com/p/entry/place/36271040?c=15.00,0,0,0,dh",이모떡즉석떡볶이,떡볶이,4.64,464,춘식고구마좋아해,139,인하대생이 추천한 인하대 떡볶이 맛집이에요! 알고보니 먹방 유튜버들도 오셨더라고요~ 이모(사장님)께서 친근하게 대해주시고 음식도 맛있어서 다음번에도 떡볶이 생각나면 갈거예요 ㅎㅎ,24.5.30.목,0
"https://map.naver.com/p/entry/place/1957094833?c=15.00,0,0,0,dh",포케품은초밥 인하대점,"초밥,롤",미공개,416,정유선39,14,"첫 방문인데 우동도 주고 맛있어요 !! 🥺🥺
롤 속재료도 푸짐하고 가격도 좋아서 부담없이 자주 올 거 같아용🫶🏽🫶🏽",3.10.월,0
"https://map.naver.com/p/entry/place/1227121732?c=15.00,0,0,0,dh",돈마니,돈가스,미공개,179,안드로보이84,13,돈까스와 생선까스가 있고 셀프바에 각종반찬과 스프 카레 밥 국수 김칫국 제육볶음 떡볶이가 있습니다. 가격은 1인 7500으로 먹기직전 바로 튀겨주시고 퀄리티도 적당한 아주 귀한 곳입니다. 방학때도 손님이 거의 만석 있었고 개학하면 대기가 있을것같아요. 착한가격으로 오래오래 부탁드립니다. 맛있게 잘먹었어요👍,1.23.목,0
"https://map.naver.com/p/entry/place/1104224962?c=15.00,0,0,0,dh",압구정수산시장 인하대점,이자카야,미공개,94,ShowUrself,375,"오코노미야키는 그냥 양배추,마요네즈,치즈… 만 가득한 느낌- 맛이 없었다는건 아닌데 그렇다고해서 딱히ㅜ맛이 ….. 쏘쏘
스끼야끼는 맛있었어요. 냄비가 좀 기울고 작아서 국물이 쏟아지기도 했지만… 국물도 맛있었고.
무엇보다 스탭분이 너무 친절하고 잘해주셔서 굿
도쿠리 무한 1인 9,900원 해서 마셨는데 4병 마셨는데 1도 안취함 .. 뭘까?",24.7.30.화,0
"https://map.naver.com/p/entry/place/1392141383?c=19.19,0,0,0,dh",효자동솥뚜껑 인하대점,돼지고기구이,미공개,608,skyblue4570,7,직원분께서 엄청 친절하시고 계란찜이랑 된장찌개 등등 구성도 알차고 고기도 엄청 맛있었어요!!!!!!!!!!,8.16.토,1
"https://map.naver.com/p/entry/place/1434154594?c=13.00,0,0,0,dh",인하로 인하대점,한식,미공개,38,지니지니77,8,진짜 닭볶음탕 먹고 싶을 때 찾는 곳 완전 맛있어요!!! 사장님도 친절하시고 매장도 깔끔하니 좋습니다 무엇보다 가까워서 너무 좋습니당 🤭,24.11.21.목,0
"https://map.naver.com/p/entry/place/1767613585?c=15.00,0,0,0,dh",뼈앓이감자탕 용현점,감자탕,미공개,242,ans****,15,"아이와 같이 방문해서 잘 먹고갑니다~
등뼈찜은 매운맛 조절이되서 애들도 먹기좋네요
고기퀄리티가좋고 사장님이 친절하십니다",8.31.일,0
"https://map.naver.com/p/entry/place/1530232206?c=13.00,0,0,0,dh",동대문엽기떡볶이 인천인하대점,분식,미공개,107,globyoul,1,"후문에 엽떡 생겨서 넘 좋아요! 근데 매장이 좀 춥네요ㅠ
마라엽떡은 먹다보니 짜서 다음엔 그냥 오리지널로 먹어봐야겠어요~",24.1.8.월,0
"https://map.naver.com/p/entry/place/1294587914?c=13.00,0,0,0,dh",레오펍 인하대점,피자,4.68,564,김민준947,10,혼밥하기 너무 좋은 곳입니다. 맛있고 피자 한조각이 엄청커서 두개먹으면 엄청 배불러요!! 너무 맛있습니다!!,8.7.목,0
"https://map.naver.com/p/entry/place/1034790169?c=15.00,0,0,0,dh",미식당,양식,미공개,610,뿌니6856,643,가성비는 짱짱굿! 그런데 메뉴판에 와인이 있어서 주문했더니 원래 와인 안한다네요 ㅠㅠ 가실분들은 참고하세요! 그리고 사장님 이 글 보시게되면 메뉴판에서 빼주세요 헷갈리는 분들 많을것같아요,21.6.9.수,0
"https://map.naver.com/p/entry/place/1801858940?c=13.00,0,0,0,dh",하하돈면,한식,미공개,262,푸와11,2,"인하대에 새로 오픈한 돈까스집이 있어서 가봤어요. 매장도 넓고 깔끔한 느낌이었습니다. 사장님이 친절하셨고, 돈까스가 바삭바삭 하고 새우튀김은 아주 실하고 너무 만족스러웠어요. 냉모밀도 맛있었고, 담엔 쫄면이랑 김치 나베 먹어보고 싶네요.
가격이 합리적이라 요즘 같은 고물가에 맘에 드는 식당 발견한것 같아서 기분 좋네요.",23.9.17.일,0
"https://map.naver.com/p/entry/place/2009691902?c=15.00,0,0,0,dh",디탕 인하대점,베트남음식,미공개,376,yoo****,27,"평소에 베트남, 태국 음식을 너무 좋아하는데 후문 근처에 생겨서 자주 오고 있어요! 쌀국수도 점보 사이즈가 있어서 둘이서 다른메뉴랑 같이 셰어하기도 좋고 볶음밥이랑 그냥 여기서 시키는 메뉴 다 너무 맛있어요ㅠㅠ 그리고 사장님이 너무 친절하셔서 오실 때 마다 정겹게 맞아주셔서 엄마 같아요...🫶",8.26.화,0
"https://map.naver.com/p/entry/place/1957094833?c=15.00,0,0,0,dh",포케품은초밥 인하대점,"초밥,롤",미공개,416,hing2,35,"샐러드 먹고 싶어서 왔어요!!
골목에 있는것도 갬성적이고 가게도 넘 깔끔해요!!
애기랑왔는데 전혀 부담스럽지 않아요
잘먹고 갑니당 ㅎㅎ☺️",3.8.토,0
"https://map.naver.com/p/entry/place/1102006774?c=13.00,0,0,0,dh",샐러리아 인하대점,"다이어트,샐러드",미공개,634,dhr****,18,정말 친절하고 샐러드가 너무 맛있어요!! 그리고 단발머리 알바생이 정말 예뻐요 꼭 다시 오고싶어져요,4.19.토,0
"https://map.naver.com/p/entry/place/1506161713?c=13.00,0,0,0,dh",끝판왕포차,포장마차,미공개,8,rla****,20,안주도 맛있고 사장님이 너무 친철하셔서 너무 편하게 술 마셨습니다. 매정도 너무 넓어서 단체로 오기 너무 좋을것 같아요,24.8.29.목,0
"https://map.naver.com/p/entry/place/20753378?c=15.00,0,0,0,dh",지지고 인천 인하대점,"도시락,컵밥",4.51,508,뚜깡뚜깡쓰,199,친절하시고 바로바로 빠르게 나옵니다 가격도 저렴하고 맛있어요!! 홀은 좁아서 여럿이 먹기엔 부적합해요 그래도 간단히 먹기에 매우 만족!,19.9.26.목,0
"https://map.naver.com/p/entry/place/1772330524?c=13.00,0,0,0,dh",롤링파스타 인하대점,"스파게티,파스타전문",미공개,252,그녕25,117,"가격도 저렴해서 파스타먹기 좋은곳 ㅎㅎ
위치도 좋고 맛있어서 자주옵니다~
친절하시구 빠르게나와용ㅎㅎ",9.26.금,1
"https://map.naver.com/p/entry/place/1595117576?c=13.00,0,0,0,dh",금별맥주 인하대점,"맥주,호프",미공개,112,Homeprotecter,2,"다른금별도 가봣는데 인하대점 맛이 않나서 당황했어요. 금별도 점바점이 있는거 같아요!
인하대점이 제일 맛있어요💜",24.6.23.일,0
"https://map.naver.com/p/entry/place/1403450091?c=18.31,0,0,0,dh",하이볼마또,퓨전음식,미공개,587,청룡리스,12,"안녕하세요. 인하대 청룡리스입니다.
벌써7번째 방문인데요. 매번 2-3차로와서 기억을 잃고
집에 가는거 같네요. 이번엔 서비스로 광어 묵은지 카르파초를 받았습니다. 늘 감사합니다. 작년 겨울 일본여행을 갔을 때 이런 일루미네이션을 많이 봤었는데 그때 향수 잠깐 느꼈습니다.
여긴 진짜 일본같고 예쁘네요. 다음에 또 오겠습니다
번창하십시오
#인하대맛집#인하대술집#인하대이자카야",24.12.5.목,0
"https://map.naver.com/p/entry/place/1042128520?c=13.00,0,0,0,dh",오이아샌드위치 인하대,샌드위치,미공개,179,뇽안9674,33,재료도 싱싱하고 엄청 맛있어요!!!! 부모님도 엄청 좋아하셨어요☺️ 사장님도 엄청 친절하시고 완전 맛집입니다🤤🤤🤤,24.1.5.금,0
"https://map.naver.com/p/entry/place/38351458?c=13.00,0,0,0,dh",신촌설렁탕,"곰탕,설렁탕",미공개,685,오렌지소연,351,진짜 너무 맛있게 먹었어요 허겁지겁 먹어서인걸까… 위장염을 얻었지만 학교 앞 갓성비 최고 신설💗,2.4.화,0
"https://map.naver.com/p/entry/place/1715794350?c=13.00,0,0,0,dh",카페밥엔술,양식,미공개,77,indah48,3,"집근처라 오늘 처음 방문해봤습니다. 파스타와 피자를 먹었는데 맛이 정말 좋았어요.^^ 사장님 부부도 친절하시고, 매장 안도 깔끔합니다. 커피와 식사 모두 가성비가 좋아 부담없이 즐길 수 있을 것 같아요. 다음엔 점심 솥밥을 먹어볼까 합니다.^^",24.3.29.금,0
"https://map.naver.com/p/entry/place/1711877761?c=13.00,0,0,0,dh",코피아,이탈리아음식,미공개,536,Li41,5,코피어 알리오올리오는 처음 먹는데 진짜 맛있어요. 그동안 먹었던 알리오올리오 중에서 제일 맛있었습니다. 양도 많고 직원분도 너무 친절하세요,5.20.화,0
"https://map.naver.com/p/entry/place/1370040618?c=15.00,0,0,0,dh",연화마을,"전,빈대떡",4.78,113,아띠다스99,13,분위기 좋은 술집을 찾는다면 강추👍🏻👍🏻요즘 술집들과 다른 분위기라 좋았어요!! 음식도 완전 맛있어요 오늘도 잘 먹고 갑니다 ㅎㅎ,23.2.13.월,1
"https://map.naver.com/p/entry/place/37762180?c=15.00,0,0,0,dh",미로곱창볶음집 인하대점,"곱창,막창,양",4.48,556,akslqpd,64,"모든 메뉴가 다 맛있어요.
‘막창.곱창 안먹는’ 1인이 추천하는 맛집입니다.
재방문이였고 다시 갈것같아요.
너무너무너무 맛있었습니당.",6.25.수,0
"https://map.naver.com/p/entry/place/34268777?c=13.00,0,0,0,dh",시골집,한식,미공개,100,와쥬,101,사장님 넘 친절하시고 후식 아포가토가 인상적인 곳이에요! 김치찌개 생각보다 괜찮았어서 다음에는 다른 메뉴 먹으러 갈 거에요!,23.5.22.월,0
"https://map.naver.com/p/entry/place/1470889138?c=13.00,0,0,0,dh",화양연화,요리주점,미공개,636,쏘조미,1,분위기도 좋고 안주도 너무 맛있어요!!!!!! 마라전골 진짜 꼭 드세요!!! 용용xx보다 백배 맛있습니당💙,3.26.수,0
"https://map.naver.com/p/entry/place/87238504?c=15.00,0,0,0,dh",계속 쪼르면,종합분식,미공개,938,이세e,56,"남쟈친구와 들렸던 쪼르면 🍴
원래는 식사를 시키고 조금씩은 남겼던 저엿지만..
쪼르면의 맛도리들은.
이런 갓성비 음식을 남기면 벌받겟구나 싶어 싹싹긁어 다 먹엇답니다 🤓
(기억하기로는) 6주년 이벤트로 몇가지 식사들이 할인한다 써있었는데 졍말 멋있다 생각했어요
다음 번에도 또 들리겠습니다~~💗",3.4.화,0
"https://map.naver.com/p/entry/place/1963692965?c=15.00,0,0,0,dh",정인곱창 인하본점,"곱창,막창,양",4.77,418,Mihyeon,751,음식도 맛있고 가격도 저렴해서 여러번 재방문하는 곳이에요 야채도 함께 주셔서 정말 가성비 최고라고 생각합니다 김치말이 국수 정말 맛있으니 꼭 드셔보시기를 추천합니다요‼️‼️,23.8.27.일,0
"https://map.naver.com/p/entry/place/1957094833?c=15.00,0,0,0,dh",포케품은초밥 인하대점,"초밥,롤",미공개,416,두리주와,238,두번째 방문입니당!  항상 싱싱하고 맛있어여~! 직원분도 친절하시고 인하대최고맛집입니다~!!,10.26.일,0
"https://map.naver.com/p/entry/place/1381954440?c=15.00,0,0,0,dh",주접집,요리주점,미공개,322,무니무너,42,"언제와도 맛있어용! 셤기간에도 사람이 많은건 이유가 있다는 거니까😏
맥주 이벤트 하고 있으니까 많이많이 오세요💗~",10.15.수,1
"https://map.naver.com/p/entry/place/1623784940?c=13.00,0,0,0,dh",또취,요리주점,미공개,453,su****,21,"근처 술집 찾다가 들어왔는데 인테리어도 취양저격
안주도~~너무 맘에 들어요
맛있게 먹고 가요~~",24.12.2.월,0
"https://map.naver.com/p/entry/place/1392141383?c=19.19,0,0,0,dh",효자동솥뚜껑 인하대점,돼지고기구이,미공개,608,Jayl,8,우선 고기가 너무 신선하고 맛있어요 반찬들도 좋구 다 먹으면 아이스크림도 있어서 마무리도 좋네요!! 다음에 또 올게요,5.29.목,0
"https://map.naver.com/p/entry/place/1878533608?c=13.00,0,0,0,dh",빙그레정육식당 인하대본점,"육류,고기요리",미공개,651,비디오20,1,"서울에서 인하대 올 일 있어서 맛집 검색해서 왔는데
4식구 완전 대만족이예요!
고기 너무 맛있고, 된찌와 비냉까지 다 맛있네요^^
인하대 근처 맛집으로 인정해요~
잘 먹고 가요",4.9.수,0
"https://map.naver.com/p/entry/place/37944103?c=15.00,0,0,0,dh",우리소참한우정육식당 인하본점,정육식당,4.53,403,챌딘,268,"기본 국물 소고기뭇국나오는데 진짜 맛있어요...ㅠㅠ
고기 질도 좋고 맛있고 사장님도 엄청 친절하십니다!",24.2.11.일,0
"https://map.naver.com/p/entry/place/1050113953?c=15.00,0,0,0,dh",인쌩맥주 인하대후문점,"맥주,호프",미공개,48,허프로 등장,8,얼마전에 왔다가 다른 안주도 맛있을까 해서 재방문했는데 역시나 믿고 먹는 인쌩 어묵탕을 시켜서 먹었는데 술이 절로 들어가는 맛이였어요 칼칼하니 너무 맛있었습니다 약간 과장하면 냉장고에 있는 소주 다 먹을 뻔했네요…^^매장은 역시 청결했고 안주도 역시 맛있고 저렴했어요 ㅎㅎ 꼭!꼭!꼭! 한번 방문해서 저처럼 맛있는 술 한잔 하고 가세용~ㅎㅎㅎㅎㅎ ,23.4.7.금,0
"https://map.naver.com/p/entry/place/1108410654?c=13.00,0,0,0,dh",온뚝,한식,미공개,181,민하엘맘,1,"집 근처에 있어서 한 번 방문해봤음.
주말 이른 시간인데도 인하대 후문에 있어서 그런지 학생들이 많았고.
가격 착하고, 1인분씩 정갈하게 음식들이 나와서 괜찮음.
식당 홀이 그리 넓진 않지만 깔끔하고 혼밥하기에 탁월한 공간임.",9.7.일,0
"https://map.naver.com/p/entry/place/1383700124?c=15.00,0,0,0,dh",성화해장국 인하점,해장국,미공개,237,lwh880,56,"사장님 너무 친절하시고 맛도 정말 맛있습니다!
강추강추! 인하대 자취생들에게 최고의 가성비 맛집!!!",21.12.2.목,0
"https://map.naver.com/p/entry/place/1711877761?c=13.00,0,0,0,dh",코피아,이탈리아음식,미공개,536,Alrighttt,32,맛있어요! 파스타 뭘 시키던 다 맛있어요. 특히 명란젓 오일 파스타 사이즈업 필수입니다~ 밍밍이랑 왔어요~!,5.26.월,0
"https://map.naver.com/p/entry/place/1034204990?c=15.00,0,0,0,dh",도시톡,바(BAR),미공개,34,doh****,1,칵테일 종류가 정말 다양한데 5900원의 가격으로 마실 수 있고 인테리어도 좋고 사장님도 친절하시고 대화도 잘 해주시고 친절하세요! 안주도 9900원이라 부담도 없고 자주 올 것 같네요,4.20.일,0
"https://map.naver.com/p/entry/place/1424888459?c=13.00,0,0,0,dh",양궈푸마라탕 인하대점,마라탕,미공개,330,채원78,12,사장님이 직접 나오셔서 마라탕 소스 추천도 해주시고 친절해요! 혼자먹을 자리도 있고 다른 매장엔 없는 재료도 있어요 다음에 또 방문하겠습니다,3.5.수,0
"https://map.naver.com/p/entry/place/1939722709?c=13.00,0,0,0,dh",덮수룩,한식,미공개,149,Bella pick,23,"양도 엄청 많고 가격도 합리적이에요!
사장님도 친절하셔서 이 지역에 다시 오게 된다면 덮수룩이 생각날 거 같아요!
잘 먹고 갑니다~",3.22.토,0
"https://map.naver.com/p/entry/place/1715722424?c=15.00,0,0,0,dh",인하 주먹고기,돼지고기구이,미공개,429,illllilliiii,14,주기적으로 꼭 오는 고기집인데 인하대 근처 고기집 다 먹어봤지만 여기가 젤 맛있습니다!!! ??,8.29.금,0
"https://map.naver.com/p/entry/place/1424888459?c=13.00,0,0,0,dh",양궈푸마라탕 인하대점,마라탕,미공개,330,박지예9853,9,"새로 생겨서 왔는데
넣을 수 있는 재료도 굉장히 많았고
특히 이 주변에서 훠궈집이 아니고서 보기 어려운 소스바!!! 가 특히 마음에 들었습니다
앞으로 자주 올 것 같아요",3.20.목,0
"https://map.naver.com/p/entry/place/1470889138?c=13.00,0,0,0,dh",화양연화,요리주점,미공개,636,fork033,28,"소고기 전골은 양 엄청많고 대체적으로 다 맛있더라구요 ㅎㅎ 다음에도 또 방문 할것 같습니다!
*업체로부터 할인혜택을 받아 구매후 솔직하게 작성했습니다*",24.8.21.수,1
"https://map.naver.com/p/entry/place/1711877761?c=13.00,0,0,0,dh",코피아,이탈리아음식,미공개,536,okm****,11,남편과 인하대 근처에 갔다가 맛집을 찾아 코피아에 갔습니다 브런치B오믈렛과 명란젓오인파스타를 먹었습니다 남편은 오일파스타가 맛있다며 남은 소스에 밥 비벼먹고 싶다고 하더라구요 사장님도 친절하시고 맛있게 먹었습니다~^^,23.9.24.일,0
"https://map.naver.com/p/entry/place/1479468560?c=15.00,0,0,0,dh",한창희천하일면 인하대점,국수,미공개,395,cutterpark,4,처음 먹으러왔는데 국물 되게 시원하고 느끼하지않고 정말 맛있게 먹었어요~ 혼밥하기도 좋아요 라멘집인줄 알았어요 처음에는요^^,6.30.월,0
"https://map.naver.com/p/entry/place/36271040?c=15.00,0,0,0,dh",이모떡즉석떡볶이,떡볶이,4.64,464,Reoo37,1,옛날즉떡 2인 주문했는데 정말 양이 많네요. 1인 5천원인데 이 정도면 정말 가성비 넘쳐요. 떡이 많이 들어있어서 면을 좋아하는데 라면사리 추가를 못했어요..ㅠ 그래도 쫄면 사리가 기본으로 들어있어서 양배추랑 맛있게 먹었어요. 튀김은 얇고 너무 바삭해서 쏘쏘했고 계란은 크기도 크고 맛있었어요. 육수가 해산물 베이스인지 해물탕 느낌도 아주 살짝 나서 국물이 개운해요. 마지막까지 약불에 졸이면서 먹었더니 마지막에는 너무 짰네요. 너무 졸이면 안될 것 같아요. 볶음밥도 양이 많아요ㅎㅎ 학교앞이라 그런지 주변 음식점 모두 저렴하네요. 이모님이 친절하셔서 더 맛있게 먹었습니다 ~,24.8.4.일,0
"https://map.naver.com/p/entry/place/1801858940?c=13.00,0,0,0,dh",하하돈면,한식,미공개,262,냠냠4944,26,나만 알고 싶은데 나만 알 수 없는 맛집.. 가격치고가 아니라 그냥 맛있어요 잡내 하나도 안 나고 깔끔하고 샐러드 스프 떡볶이 먹을 거 너무 많고 사장님도 넘 친절하세용 인후 돈까스 찾다가 여기서 한 번 먹고 돈까스 땡기면 다른 곳 갈 생각이 안 들어요!!,8.21.목,0
"https://map.naver.com/p/entry/place/36271040?c=15.00,0,0,0,dh",이모떡즉석떡볶이,떡볶이,4.64,464,인천의전설,442,서민 대표음식 답게 정말 이 가격으로 배불리 먹을 수 있는건 떡볶죠. 사장님도 너무 친절하시고 떡볶이가 정말 맛있네요. 누가 인천 몇대 떡볶이라고 정하는지 모르겠지만 제 생각에는 3대장 안에 듭니다. ^^ 튀김도 맛있었어요.  잘먹고 가요~~,1.5.일,0
"https://map.naver.com/p/entry/place/1748522357?c=13.00,0,0,0,dh",큐슈울트라아멘 인하대점,일본식라면,미공개,279,thesol8821,12,울트라아멘 단품으로 주문했습니다. 양이 많아 든든하게 먹고 갈 수 있어서 좋아요 맛있게 먹고갑니다,8.1.금,0
"https://map.naver.com/p/entry/place/2009691902?c=15.00,0,0,0,dh",디탕 인하대점,베트남음식,미공개,376,Smile Travel reader,980,"신포동에서 먹고 반했던 디탕이 인하대후문에도 생겼어요! 반쎄오와 해산물팟타이, 깔라만시 먹었는데, 이미 입증된 디탕이니 맛이야 설명할 필요도 없어요! 더 대박인건, 너무나도 친절하고 유쾌하신 사장님! 지금 오픈이벤트라 베트남 과자도 주시고 셀프바에서 꿰이도 맘껏 먹을 수 있어요. 인심이 너무 좋으셔서 학생분들도 엄청 좋아하시더라구요. 당연히 재방문각입니다!",8.28.목,0
"https://map.naver.com/p/entry/place/1844234741?c=13.00,0,0,0,dh",소소한밥상,한식,미공개,37,MS써니,42,"가정식백반 가성비 짱짱
6000원에 맛있는 가리비미역국
사장님 손커서 국 음청 주네요
먹고 나면 속이 편하구 기분 좋아지는 밥집이네요
전 매일 여기서 점심 식사 ㅋ
메뉴고민 안해서 넘좋아여♡♡",2.28.금,0
"https://map.naver.com/p/entry/place/1381954440?c=15.00,0,0,0,dh",주접집,요리주점,미공개,322,윤 아린,659,"데이트하기 분위기 딱 좋아요 ㅎ
특별한 메뉴와 시그니쳐 소주까지!!
신나고 맛있게 먹고왔어요 :)",22.5.28.토,1
"https://map.naver.com/p/entry/place/1715722424?c=15.00,0,0,0,dh",인하 주먹고기,돼지고기구이,미공개,429,minihong,34,"2000년대 대학가 주먹고기집 생각이 나는 저에게는 추억의 식당이에요
깔끔하고 고기도 냄새없이 맛있어요~
처음에 고기 직접 구워주셔서 넘나 좋네요~
찌개, 반찬들도 맛맛
즐거운 시간 만들어주셔서 감사합니다~",8.20.수,0
"https://map.naver.com/p/entry/place/1470889138?c=13.00,0,0,0,dh",화양연화,요리주점,미공개,636,힙여시,195,"마라전골 넘나 맛 좋아요~
양도 푸짐 가격도 저렴 넘나 맛나요
마라전골과 꿔바로우 먹음 양이 많아 전골만 시켜도 양 그득 소스랑 같이 먹음 맛도리에요
맛있어요 창가자리도 좋고 좋네요
모기가 물어서 좀 힘든건 안비밀 통창이 열려있기 때문이겠죠^^",24.11.15.금,0
"https://map.naver.com/p/entry/place/1392141383?c=19.19,0,0,0,dh",효자동솥뚜껑 인하대점,돼지고기구이,미공개,608,Bj990803,7,"고기도 부드럽고 반찬도 깔끔해서 너무 잘 먹었어요!
직원분들이 친절해서 기분까지 좋아지는 식사였습니다!!
이벤트도 참여하고 행복한 하루 마무리합니다! 특히 밑반찬으로 나온 갓김치 리얼 배우신 분!!!!",10.18.토,0
"https://map.naver.com/p/entry/place/1767613585?c=15.00,0,0,0,dh",뼈앓이감자탕 용현점,감자탕,미공개,242,ror****,10,집 앞에ㅠ있능 가게인데 배달로도 먹어보고 매장으로 와서도 먹었는데 그냥 너무 맛있슺니당...,10.11.토,0
"https://map.naver.com/p/entry/place/1574688174?c=15.00,0,0,0,dh",솥고기67번길,돼지고기구이,미공개,557,pin****,34,TV가 있어서 스포츠같은거 보면서 먹을 수 있어요 매장도 깨끗하고 꼬기도 맛있어요! 버터도 주셔서 판에다가 바르고 꾸어먹었는데 냄새도 좋아요,24.9.11.수,0
"https://map.naver.com/p/entry/place/1470889138?c=13.00,0,0,0,dh",화양연화,요리주점,미공개,636,김다삐,31,맨날 지나가면서 가보고 싶다 생각했는데 드디어 처음 와봤어요~~~ 너무너무 맛있고 양도 많고 좋아요😋👍,23.11.16.목,1
"https://map.naver.com/p/entry/place/1090243948?c=13.00,0,0,0,dh",와이키키피자,피자,미공개,326,윤다빈,24,우연히 방문한 곳인데 피자가 너무 맛있구 같이 나온 스파게티도 너무 맛있었어용 꼭 여러분 포테이토랑 패퍼로니 하프앤하프시키고 스파게티는 패패로니 시켜서 피자에부어서 드세요 치킨텐더두조각시켜서 조각내서 올려드시면 맛있을거에요,24.12.19.목,0
"https://map.naver.com/p/entry/place/2009691902?c=15.00,0,0,0,dh",디탕 인하대점,베트남음식,미공개,376,짱이에요14,100,메뉴도 많고 모닝글로리 한국에서 먹고싶엇는데 잇어서 호다닥 달려왓어요ㅠ 스지쌀국수도 잇어서 좋아요,9.7.일,0
